{
  "schema": "zeros/1",
  "generated_by": "f16d927",
  "params": {"t_max": 500, "engine": "riemann-siegel scan + euler-maclaurin refine", "oracle": "none"},
  "aggregate": {"complete": true, "n_expected": 269, "n_found": 269, "t_top": 499.15753353, "n_good_gram": 264, "n_gram_law_exceptions": 12, "n_close_pairs": 8, "n_refined_blocks": 0, "max_odlyzko_dev": null},
  "zeros": [
    {"n": 1, "gamma": 14.1347251417},
    {"n": 2, "gamma": 21.0220396388},
    {"n": 3, "gamma": 25.0108575801},
    {"n": 4, "gamma": 30.4248761259},
    {"n": 5, "gamma": 32.9350615877},
    {"n": 6, "gamma": 37.5861781588},
    {"n": 7, "gamma": 40.9187190121},
    {"n": 8, "gamma": 43.3270732809},
    {"n": 9, "gamma": 48.0051508812},
    {"n": 10, "gamma": 49.7738324777},
    {"n": 11, "gamma": 52.9703214777},
    {"n": 12, "gamma": 56.4462476971},
    {"n": 13, "gamma": 59.3470440026},
    {"n": 14, "gamma": 60.8317785246},
    {"n": 15, "gamma": 65.1125440481},
    {"n": 16, "gamma": 67.0798105295},
    {"n": 17, "gamma": 69.5464017112},
    {"n": 18, "gamma": 72.0671576745},
    {"n": 19, "gamma": 75.7046906991},
    {"n": 20, "gamma": 77.1448400689},
    {"n": 21, "gamma": 79.3373750202},
    {"n": 22, "gamma": 82.9103808541},
    {"n": 23, "gamma": 84.7354929805},
    {"n": 24, "gamma": 87.4252746131},
    {"n": 25, "gamma": 88.8091112076},
    {"n": 26, "gamma": 92.4918992706},
    {"n": 27, "gamma": 94.6513440405},
    {"n": 28, "gamma": 95.8706342282},
    {"n": 29, "gamma": 98.8311942182},
    {"n": 30, "gamma": 101.317851006},
    {"n": 31, "gamma": 103.72553804},
    {"n": 32, "gamma": 105.446623052},
    {"n": 33, "gamma": 107.168611184},
    {"n": 34, "gamma": 111.029535543},
    {"n": 35, "gamma": 111.874659177},
    {"n": 36, "gamma": 114.320220915},
    {"n": 37, "gamma": 116.226680321},
    {"n": 38, "gamma": 118.790782866},
    {"n": 39, "gamma": 121.370125002},
    {"n": 40, "gamma": 122.946829294},
    {"n": 41, "gamma": 124.256818554},
    {"n": 42, "gamma": 127.51668388},
    {"n": 43, "gamma": 129.5787042},
    {"n": 44, "gamma": 131.087688531},
    {"n": 45, "gamma": 133.497737203},
    {"n": 46, "gamma": 134.756509753},
    {"n": 47, "gamma": 138.116042055},
    {"n": 48, "gamma": 139.736208952},
    {"n": 49, "gamma": 141.123707404},
    {"n": 50, "gamma": 143.111845808},
    {"n": 51, "gamma": 146.000982487},
    {"n": 52, "gamma": 147.422765343},
    {"n": 53, "gamma": 150.053520421},
    {"n": 54, "gamma": 150.925257612},
    {"n": 55, "gamma": 153.024693811},
    {"n": 56, "gamma": 156.112909294},
    {"n": 57, "gamma": 157.597591818},
    {"n": 58, "gamma": 158.849988171},
    {"n": 59, "gamma": 161.188964138},
    {"n": 60, "gamma": 163.030709687},
    {"n": 61, "gamma": 165.537069188},
    {"n": 62, "gamma": 167.184439978},
    {"n": 63, "gamma": 169.094515416},
    {"n": 64, "gamma": 169.911976479},
    {"n": 65, "gamma": 173.41153652},
    {"n": 66, "gamma": 174.754191523},
    {"n": 67, "gamma": 176.441434298},
    {"n": 68, "gamma": 178.377407776},
    {"n": 69, "gamma": 179.91648402},
    {"n": 70, "gamma": 182.207078484},
    {"n": 71, "gamma": 184.874467848},
    {"n": 72, "gamma": 185.598783678},
    {"n": 73, "gamma": 187.228922584},
    {"n": 74, "gamma": 189.416158656},
    {"n": 75, "gamma": 192.026656361},
    {"n": 76, "gamma": 193.079726604},
    {"n": 77, "gamma": 195.26539668},
    {"n": 78, "gamma": 196.876481841},
    {"n": 79, "gamma": 198.015309676},
    {"n": 80, "gamma": 201.264751944},
    {"n": 81, "gamma": 202.493594514},
    {"n": 82, "gamma": 204.189671803},
    {"n": 83, "gamma": 205.394697202},
    {"n": 84, "gamma": 207.906258888},
    {"n": 85, "gamma": 209.576509717},
    {"n": 86, "gamma": 211.690862595},
    {"n": 87, "gamma": 213.34791936},
    {"n": 88, "gamma": 214.547044783},
    {"n": 89, "gamma": 216.169538508},
    {"n": 90, "gamma": 219.067596349},
    {"n": 91, "gamma": 220.714918839},
    {"n": 92, "gamma": 221.430705555},
    {"n": 93, "gamma": 224.007000255},
    {"n": 94, "gamma": 224.98332467},
    {"n": 95, "gamma": 227.42144428},
    {"n": 96, "gamma": 229.337413306},
    {"n": 97, "gamma": 231.2501887},
    {"n": 98, "gamma": 231.987235253},
    {"n": 99, "gamma": 233.693404179},
    {"n": 100, "gamma": 236.524229666},
    {"n": 101, "gamma": 237.769820481},
    {"n": 102, "gamma": 239.555477573},
    {"n": 103, "gamma": 241.049157796},
    {"n": 104, "gamma": 242.823271934},
    {"n": 105, "gamma": 244.070898497},
    {"n": 106, "gamma": 247.136990075},
    {"n": 107, "gamma": 248.10199006},
    {"n": 108, "gamma": 249.573689645},
    {"n": 109, "gamma": 251.014947795},
    {"n": 110, "gamma": 253.069986748},
    {"n": 111, "gamma": 255.306256455},
    {"n": 112, "gamma": 256.380713694},
    {"n": 113, "gamma": 258.610439492},
    {"n": 114, "gamma": 259.87440699},
    {"n": 115, "gamma": 260.805084505},
    {"n": 116, "gamma": 263.573893905},
    {"n": 117, "gamma": 265.557851839},
    {"n": 118, "gamma": 266.614973782},
    {"n": 119, "gamma": 267.921915083},
    {"n": 120, "gamma": 269.970449024},
    {"n": 121, "gamma": 271.494055642},
    {"n": 122, "gamma": 273.459609188},
    {"n": 123, "gamma": 275.587492649},
    {"n": 124, "gamma": 276.452049503},
    {"n": 125, "gamma": 278.25074353},
    {"n": 126, "gamma": 279.229250928},
    {"n": 127, "gamma": 282.465114765},
    {"n": 128, "gamma": 283.211185733},
    {"n": 129, "gamma": 284.835963981},
    {"n": 130, "gamma": 286.667445363},
    {"n": 131, "gamma": 287.911920501},
    {"n": 132, "gamma": 289.579854929},
    {"n": 133, "gamma": 291.846291329},
    {"n": 134, "gamma": 293.558434139},
    {"n": 135, "gamma": 294.965369619},
    {"n": 136, "gamma": 295.573254879},
    {"n": 137, "gamma": 297.979277062},
    {"n": 138, "gamma": 299.840326054},
    {"n": 139, "gamma": 301.649325462},
    {"n": 140, "gamma": 302.69674959},
    {"n": 141, "gamma": 304.864371341},
    {"n": 142, "gamma": 305.728912602},
    {"n": 143, "gamma": 307.219496128},
    {"n": 144, "gamma": 310.109463147},
    {"n": 145, "gamma": 311.16514153},
    {"n": 146, "gamma": 312.427801181},
    {"n": 147, "gamma": 313.985285731},
    {"n": 148, "gamma": 315.475616089},
    {"n": 149, "gamma": 317.734805942},
    {"n": 150, "gamma": 318.853104256},
    {"n": 151, "gamma": 321.160134309},
    {"n": 152, "gamma": 322.144558672},
    {"n": 153, "gamma": 323.466969558},
    {"n": 154, "gamma": 324.862866052},
    {"n": 155, "gamma": 327.443901262},
    {"n": 156, "gamma": 329.03307168},
    {"n": 157, "gamma": 329.953239728},
    {"n": 158, "gamma": 331.474467583},
    {"n": 159, "gamma": 333.645378525},
    {"n": 160, "gamma": 334.211354833},
    {"n": 161, "gamma": 336.841850428},
    {"n": 162, "gamma": 338.339992851},
    {"n": 163, "gamma": 339.858216725},
    {"n": 164, "gamma": 341.042261111},
    {"n": 165, "gamma": 342.05487751},
    {"n": 166, "gamma": 344.66170294},
    {"n": 167, "gamma": 346.347870566},
    {"n": 168, "gamma": 347.272677584},
    {"n": 169, "gamma": 349.316260871},
    {"n": 170, "gamma": 350.408419349},
    {"n": 171, "gamma": 351.878649025},
    {"n": 172, "gamma": 353.488900489},
    {"n": 173, "gamma": 356.017574977},
    {"n": 174, "gamma": 357.151302252},
    {"n": 175, "gamma": 357.952685102},
    {"n": 176, "gamma": 359.743754953},
    {"n": 177, "gamma": 361.289361696},
    {"n": 178, "gamma": 363.331330579},
    {"n": 179, "gamma": 364.736024114},
    {"n": 180, "gamma": 366.212710288},
    {"n": 181, "gamma": 367.993575482},
    {"n": 182, "gamma": 368.968438096},
    {"n": 183, "gamma": 370.050919212},
    {"n": 184, "gamma": 373.061928372},
    {"n": 185, "gamma": 373.864873911},
    {"n": 186, "gamma": 375.825912767},
    {"n": 187, "gamma": 376.324092231},
    {"n": 188, "gamma": 378.43668025},
    {"n": 189, "gamma": 379.872975347},
    {"n": 190, "gamma": 381.484468617},
    {"n": 191, "gamma": 383.44352945},
    {"n": 192, "gamma": 384.956116815},
    {"n": 193, "gamma": 385.861300846},
    {"n": 194, "gamma": 387.222890222},
    {"n": 195, "gamma": 388.846128354},
    {"n": 196, "gamma": 391.456083564},
    {"n": 197, "gamma": 392.24508334},
    {"n": 198, "gamma": 393.427743844},
    {"n": 199, "gamma": 395.582870011},
    {"n": 200, "gamma": 396.381854223},
    {"n": 201, "gamma": 397.91873621},
    {"n": 202, "gamma": 399.985119876},
    {"n": 203, "gamma": 401.839228601},
    {"n": 204, "gamma": 402.861917764},
    {"n": 205, "gamma": 404.2364418},
    {"n": 206, "gamma": 405.13438746},
    {"n": 207, "gamma": 407.581460387},
    {"n": 208, "gamma": 408.947245502},
    {"n": 209, "gamma": 410.513869193},
    {"n": 210, "gamma": 411.972267804},
    {"n": 211, "gamma": 413.26273607},
    {"n": 212, "gamma": 415.018809755},
    {"n": 213, "gamma": 415.455214996},
    {"n": 214, "gamma": 418.38770579},
    {"n": 215, "gamma": 419.861364818},
    {"n": 216, "gamma": 420.643827625},
    {"n": 217, "gamma": 422.076710059},
    {"n": 218, "gamma": 423.716579627},
    {"n": 219, "gamma": 425.069882494},
    {"n": 220, "gamma": 427.208825084},
    {"n": 221, "gamma": 428.127914077},
    {"n": 222, "gamma": 430.328745431},
    {"n": 223, "gamma": 431.301306931},
    {"n": 224, "gamma": 432.138641735},
    {"n": 225, "gamma": 433.889218481},
    {"n": 226, "gamma": 436.161006433},
    {"n": 227, "gamma": 437.581698168},
    {"n": 228, "gamma": 438.621738656},
    {"n": 229, "gamma": 439.918442214},
    {"n": 230, "gamma": 441.683199201},
    {"n": 231, "gamma": 442.904546303},
    {"n": 232, "gamma": 444.319336278},
    {"n": 233, "gamma": 446.860622696},
    {"n": 234, "gamma": 447.441704194},
    {"n": 235, "gamma": 449.148545685},
    {"n": 236, "gamma": 450.12694578},
    {"n": 237, "gamma": 451.403308445},
    {"n": 238, "gamma": 453.986737807},
    {"n": 239, "gamma": 454.974683769},
    {"n": 240, "gamma": 456.328426689},
    {"n": 241, "gamma": 457.903893064},
    {"n": 242, "gamma": 459.513415281},
    {"n": 243, "gamma": 460.087944422},